{
	"$schema": "./config_schema.json",
	"cert_path": "D:/Coding/certs/grpc-test-ps.westeurope.cloudapp.azure.com/fullchain.pem",
	"key_path": "D:/Coding/certs/grpc-test-ps.westeurope.cloudapp.azure.com/privkey.pem",
	"server_addr": "0.0.0.0:50051",
	"use_tls": false,
	"jwt_settings": {
		"issuer": "http://localhost:50051",
		"access_token_key": "cneTgPm7QcfRuEt1d0Mb/QfS2OUy95Xap9goBfTAqsY=",
		"access_token_expiration_minutes": 1,
		"refresh_token_key": "QAxMM7/oCPoCvYJAn2UDWdYcj+iXFOqKpn+fYu/ADgE=",
		"refresh_token_expiration_minutes": 43200
	},
	"password_work_factor": 4
}
